{"template_request_version":"v1","request_id":"project-one-page-request-v1","institution":"edudoc","document_type":"프로젝트현황한장보고서","purpose":"프로젝트 상태를 한 페이지로 공유한다.","requested_items":[{"request_item_id":"project","description":"프로젝트명","must_include":true},{"request_item_id":"owner","description":"책임자","must_include":true},{"request_item_id":"summary","description":"핵심 요약","must_include":true},{"request_item_id":"progress","description":"추진 현황","must_include":true},{"request_item_id":"results","description":"주요 성과","must_include":true},{"request_item_id":"issues","description":"이슈","must_include":true},{"request_item_id":"requests","description":"요청사항","must_include":true}],"fixed_text":["프로젝트 현황 한장보고서"],"design_requirements":[],"reference_scope":{"mode":"institution_baseline_only"},"constraints":["A4 한 페이지"]}
