{
  "template_request_version": "v1",
  "request_id": "weekly-report-request-v2",
  "institution": "edudoc",
  "document_type": "주간업무보고서",
  "purpose": "팀의 주간 업무 상태, 이슈, 계획과 지원 요청을 한 페이지로 공유한다.",
  "requested_items": [
    {"request_item_id": "report_period", "description": "보고 기간", "must_include": true},
    {"request_item_id": "author", "description": "작성자", "must_include": true},
    {"request_item_id": "audience", "description": "보고 대상", "must_include": true},
    {"request_item_id": "written_on", "description": "작성일", "must_include": true},
    {"request_item_id": "document_category", "description": "문서 구분", "must_include": true},
    {"request_item_id": "weekly_summary", "description": "이번 주 핵심 요약", "must_include": true},
    {"request_item_id": "major_tasks", "description": "주요 업무 현황", "must_include": true},
    {"request_item_id": "achievements", "description": "성과 및 특이사항", "must_include": true},
    {"request_item_id": "risks", "description": "이슈 및 리스크", "must_include": true},
    {"request_item_id": "next_week_plan", "description": "다음 주 계획", "must_include": true},
    {"request_item_id": "support_requests", "description": "지원 요청 사항", "must_include": true}
  ],
  "fixed_text": ["주간업무보고서"],
  "design_requirements": [],
  "reference_scope": {"mode": "institution_baseline_only"},
  "constraints": ["A4 한 페이지"]
}
